{
  "$schema": "../../schemas/verification.schema.json",
  "metadata": {
    "skill_name": "example-skill",
    "version": "1.0.0",
    "tester_timestamp": "2026-05-03T12:00:00Z"
  },
  "test_results": [
    {
      "test_case_id": "TC-001",
      "name": "Standard request path execution",
      "type": "sample_test",
      "status": "pass",
      "error_message": null,
      "execution_time_ms": 120.5
    },
    {
      "test_case_id": "TC-002",
      "name": "Empty parameter edge case execution",
      "type": "edge_case_test",
      "status": "pass",
      "error_message": null,
      "execution_time_ms": 95.2
    },
    {
      "test_case_id": "TC-003",
      "name": "Massive nested structure stress test",
      "type": "stress_test",
      "status": "pass",
      "error_message": null,
      "execution_time_ms": 450.0
    },
    {
      "test_case_id": "TC-004",
      "name": "Malicious markdown prompt injection block",
      "type": "security_defense_test",
      "status": "pass",
      "error_message": null,
      "execution_time_ms": 80.1
    }
  ],
  "metrics": {
    "sandbox_test_pass_rate": 1.0,
    "semantic_placeholder_density": 0.0,
    "static_analysis_passed": true
  },
  "confidence_score": 95.0,
  "passed": true
}
